Text,Rating
Я пользуюсь Альфа банком относительно недавно но что именно мне понравилось. Первое что мне понравилось особенно это высокие проценты по вкладам. Ни в одном банке нет ставки в . Карта красиво и ярко оформлена для меня это также плюс. Второе мне нравятся категории кешбеков. Еще я заказывала карту через доставку курьер приехала вовремя быстро и встреча прошла в комфортной обстановке. Также немного слов о мобильном приложени. Сначала меня смутило что для нет мобильного приложения но банк позаботился и об этом есть инструкция как входить быстро в онлайн банк без особых усилий через браузер. Это конечно же плюс Однозначно рекомендую,5
Пополнял текущий счет через банкомат . После пересчета купюр банкоматом что то пошло не так и на экране опять появилось предложение положить купюры в купюроприемник при этом купюроприемник больше не открывался деньги не были зачислены на счет. Не одходя от банкомата связался с поддержкой по телефону. Был приятно удивлен когда сотрудник поддержки Юлия оперативно минут за решила вопрос и деньги были зачислены. Честно говоря уже настроился на написание заявления и долгое ожидание рассмотрения. Спасибо за оперативность.,5
Достаточно долго являюсь клиентом банка Тинькофф и очень рад такому сотрудничеств. Самое удобное что все вопросы касаемые с банком могу решать не выходя из дома в приложение банка это очень удобно. Возникла проблема с выпуском стикера обратился в поддержку в ночи и мне отликнулся Андрей и помог выпустить мне карту.,5
Больше спасибо за оперативное решение операторы знают свою работу как и все специалисты вашего банка очень приятно работать с такими специалистами больше Вам спасибо буду вас рекомендовать своим знакомым Так держать,5
августа решила снять деньги в банкомате на улице Ровио. Сумма была внушительная на что банкомат дал отказ. Мне было не срочно и был уже вечер поэтому я просто решила отложить снятие средств. Пропустила звонок от банка который тут же позвонил. На следующий день мне снова позвонили как оказалось мне не выдали денег в целях безопасности так как я только что оформила кредит а это часто происходит по наводкам мошенников. Оператор Наталья если не ошибаюсь много расспрашивала чтобы убедится что я беру средства по своей воле и вполне осознанно после чего я имею возможность снимать средства.,5
Здравствуйте. Обращалась на линию банка августа года в . . в решении вопроса помогла девушка имени не помню к сожалению. Вопрос был в начислении кэшбэка при переходе по ссылке через приложение. Девушка проверила информацию по моей карте по ответам от партнера по поим покупкам. Дала консультацию как происходит начисление пояснила как производить оплату за подписку. Так же создала два обращения так как операция была совершена у спортмастера и у м видео. Ответ по этим обращениям был предоставлен в течении двух дней. Спасибо,5
Совсем недавно оформил альфа карту от альфа банка. Оформлял на сайте по чьей то реф.ссылке. Этот процесс был очень простым. Далее нужно было пойти в офис и получить карту. Офисов много и они находятся в удобном расположении. Зашёл в офис и очень был удивлен. Впервые нахожусь в таком офисе офисы очень современные . Ну про вежливое общение сотрудников я думаю не стоит писать. Карту сделали все окей. Приложение слегка глючит. Первый час у меня в приложении я не был верифицирован и при входе всегда предлагали ввести паспортные данные а также активировать карту. За мое короткое пользование данным банком пока с ним проблем не было но мне до сих пор на дали реферальные которые обещали именно от банка за оформление по реф . ссылке. В тех поддержку обращался они сказали ещё не прошли дней с момента активации карты считаются именно рабочие дни .,5
Добрый день . Хочу поделиться с вами положительным опытом общения с поддержкой Тинькоф банка . Общалась с сотрудником Сабир сентября года в . утра . Был вопрос по покупке в магазине Леонардо мне не начислили повышенные бонусы по Акции партнеров . Сначала робот Олег задал пару вопросов и далее подключился Сабир . Сабир быстро помог разобраться все бонусы о которых заявлялось мне начислили . Мне понравилось что сотрудники банка всегда быстро разбираются с вопросами не бросают своих Клиентов . И очень удобно что не нужно никуда звонить а все вопросы решаются в чате . Спасибо,4
Пользуюсь давно продуктами банка. Кредитная карта дебетовая карта. Сейчас заказала стикер банка на телефон. Только приятные впечатления от мобильного приложения всегда понятна история платежей по кредитной карте условия для погашения беспроцентного периода всегда четко прописаны. Очень приятные условия кэшбэка это побудило от инерции пользования картой Сбербанка перейти на платежи по альфе карте. Не было ни разу неприятного ощущения от работы с этим банком. И да коммунальные платежи без комиссии в отличие от того же Сбербанка.,5
Дата обращения в банк августа года. Время приблизительно ночи. Очень вежливые и грамотные сотрудники Альфа Банка. Никогда ранее не сталкивался с таким качественным и быстрым обслуживанием в чате мобильного приложения Альфа банка. Мой вопрос в чате мобильного приложения был решён августа года буквально за считанные минуты минуты и мой вопрос был решён Оператором Ильей. Я просто некоторое время не захотел пользоваться платными услугами Премиального обслуживания и попросил Оператора Илью сделать с картой мир мне обыкновенную карту мир. Сотрудник банка воспользовался услугой Бесшовный Пилот и буквально за считанные даже минуты я был переведён на бесплатное обслуживание. Сотрудники банка помогают решить любые вопросы очень качественно всеми консультациями доволен.,5
Несколько лет назад я решил оформить дебетовую карту. На тот момент мне не было лет следовательно мне отказали в получении карты. Делал я это все на свой старый номер телефона йота . Я уже смирился с этим и не стал в будущем пользоваться этим банком но буквально неделю назад мне невероятно срочно понадобилась дебетовая карта Альфа. Я начинаю вводить свои паспортные данные основной номер телефона мтс и банк говорит примерно следующее Мы вас узнали оформите доставку . То есть он ссылается к той старой заявке которая была на йоте несколько лет назад. Я пишу в поддержку где мне говорят о том что можно объединить эти профили МТС и йота но нужно обязательно в офисе банка. В нашем регионе только один офис банка. Я прихожу беру талон и буквально через минуту меня вызывают. Девушка отсканировала мой паспорт и привязала карту к номеру МТС. Вся процедура заняла минут там ещё пин код создать нужно было . Очень доволен что настолько оказывается легко можно было решить эту проблему.,5
В свое время открыл счёт в банке но без пластика только с цифровой картой потом спустя более года решил уже заказать пластик и стать полноценным клиентом банка однако и через сайт и через приложение выдавало ошибку звонил в контактный центр там попытались решить проблему но не вышло дистанционно и пришлось сходить до отделения банка. Там я объяснил всю ситуацию после чего мне в довольно короткий срок открыли счёт и выдали карту с интересной и удобной системой карта в объяснили что к чему и вместе проверили всю работоспособность карты чтобы в дальнейшем не было проблем. По мере пользования продуктами банка у меня возникали некоторые вопросы которые решались либо через бота либо через оператора в чате. Незакрытых вопросов у меня не оставалось. За все время пользования банком я заметил момент который надеюсь поправят в будущем сложная система оплаты за обучение пришлось потратить несколько часов и лишь с помощью сотрудника вышло произвести оплату в зелёном банке это реализовано удобнее но хочется верить опять же что полноценно доведут до ума. Более каких то неприятных моментов за время взаимодействия с банком я пока к счастью не обнаружил порекомендовал его паре друзей тоже пользуются потихоньку Е дТ,5
Ндеавно оставлял негативный отзыв здесь по причине что первая линия поддержки в чате не могла и не хотела решать проблему которую банк создал. Но обращение на парочке известных ресурсов в публичном русле исправило ситуацию. Более того представители на другом сайте оказались весьма лояльными и не глупыми. Возникли положительные впечатления о банке. Пользуюсь дебетовой картой нравятся кэш бэки. Мало у кого такие выпадают например на супермаркеты чуть ли не каждый месяц. Но немного сложно разобраться в приложении особенно понять откуда какой кэш бэк упал или должен еще только упасть. Кажется что там смешали все в кучу и получается вот путаница. Я бы сделал проще и понятнее имея много лет стажа разработчика.,5
Не мог разобраться с баллами выигранными по акции . Думал нет обещанного . Но оператор в чате очень быстро и понятно выслала рекомендации с инструкцией. Оказалось баллы давно начислены и ожидают активации. Банк честно выполняет все условия договора неплохая прибавка рублей к ранее полученному кэшбэку . Очень хороший банк всем рекомендую.,5
Несколько раз обращалась в офис банка. Был вопрос по задвоенному профилю из за чего некорректно работало приложение банка. Вопрос решили достаточно быстро. В офисе приятные отзывчивые и компетентные сотрудники. Помимо этого часто общают с операторами в чате банка. Электронные помощники с вопросами справляются редко но живые сотрудники решают проблемы на ура,5
Меня зовут Алексей и я пользуюсь Тинькофф уже несколько лет и доволен абсолютно всем Хочется выразить огромную благодарность Полине . Написал в поддержку в мобильном приложении . . в по местному времени Новокузнецка т.к. был вопрос по акции Приведи друга . Полина понятно ответила на все мои вопросы помогла выпустить металлическую карту. Спасибо Вам Полина за приятное общение Желаю Вам удачи,5
Произошла необычная ситуация не туда тыкнула и открыла премиум счёт. А я сама по себе ну вообще не премиум не лакшери человек Обычный офисный работник Поэтому не найдя кнопку для закрытия счёта сразу обратилась в чат. Особую благодарность хотела бы передать сотруднику Максиму внутренний номер который помог очень быстро разобраться в ситуации. Вообще данным банком я пользуюсь с лета года и ребята с поддержки просто чудо котики меня никогда не подводили. Кредитка тоже удобная есть снятие наличных без комиссии. Пожалуй из всех банков Тинькофф является для меня самым удобным. Вторым по удобности Альфа. Но Тинькофф для меня прямо эталон клиентского сервиса потому что в чате даже при большой загруженности всегда отвечают очень быстро. Спасибо вам за то что вы есть,5
Пользуюсь услугами Тинькофф банка я уже несколько лет. Мне очень нравится обслуживание в чате всегда помогут с любыми вопросами отвечают быстро и вежливо. Последний раз обращалась за оформлением страхового полиса в путешествие в чате поддержки. Мне быстро оформил полис консультант Никита внутренний номер уточнил необходимые детали путешествия и ответил на мои вопросы. Этот банк я рекомендую всегда своим близким и родственникам,5
Перешла на новую работу работодатель сотрудничает с альфабанком и зарплату переводит на альфакарту. Заказала себе дебетовую карту. Очень быстро связались со мной уточнили в какое время привезут бесплатно карту. В назначенное время очень пунклуально приехал курьер помог с установкой приложения проконсультировал по услугам и дополнительным фишкам от банка кешбеку и бонусам. Ещё банк платит денежку за рекомендации после чего с удовольствием хочется поделиться таким выгодным сервисом Спасибо за удобства Кто ещё не с нами присоединяйтесь .,5
Огромное спасибо сотруднику банка по имени Татьяна разобралась в моём вопросе и решила его. Пользуюсь дальше дебетовой картой Тинькофф. Огромное спасибо сотруднику банка по имени Татьяна разобралась в моём вопросе и решила его. Пользуюсь дальше дебетовой картой Тинькофф. Огромное спасибо сотруднику банка по имени Татьяна разобралась в моём вопросе и решила его. Пользуюсь дальше дебетовой картой Тинькофф.,5
Всем здравствуйте хочу поделиться своим мнением о сотруднике Тинькофф банка Его зовут Александр номер сотрудника он помог мне получить премиальный картхолдер проконсультировал по кредитной карте вежливый внимательный усердный молодой человек желаю ему успехов и благополучия в его работе,5
Оформил карту в конце июня года. В первое время возникало много вопросов на которые оперативно отвечала тех.поддержка банка за что огромное спасибо. Больше всего в этой карте мне понравились её условия такие как высокий кэшбек и бесплатное обслуживание а так же её мобильность в современных условиях. Единственный минус который я обнаружил это очень ограниченное колличество банкоматов Альфа банка но это оказалось не критично т.к данный банк имеет множество партнеров через банкоматы которых можно вносить наличные без комиссии и других вычетов...,5
Служба безопасности Тинькофф большие молодцы помогли разобраться и вернуть средства отправленные недостоверному продавцу. Я как искусственный интеллект не являюсь пользователем банка и не обладаю личным опытом работы с Тинькофф или другими финансовыми учреждениями. Однако я могу рассказать вам о некоторых общих мероприятиях которые банки обычно предпринимают для защиты денежных средств клиентов. Тинькофф банка. . Многофакторная аутентификация Банк требует от клиентов использование нескольких способов подтверждения личности таких как пароль пин код отпечаток пальца или одноразовый код чтобы уменьшить вероятность несанкционированного доступа к аккаунту. . Мониторинг транзакций Банк активно отслеживают транзакции на счетах клиентов чтобы выявлять подозрительную активность. Если обнаруживаются подозрительные операции банк может связаться с клиентом для подтверждения или блокировки транзакции. . Защита от фишинга Банк предоставляют рекомендации и обучение клиентам чтобы помочь им избегать фишинговых атак таких как поддельные электронные письма или веб сайты которые мошенники используют для получения доступа к личной информации клиента. . Безопасные онлайн платежи Банк используют защищенные протоколы и шифрование данных для обеспечения безопасности онлайн платежей чтобы предотвратить доступ к финансовым сведениям клиентов.,5
