Text,Rating
Я пользуюсь данной картой уже года и она полностью оправдывает все мои ожидания. Во первых удобство использования. Карта от Тинькофф предоставляет мне возможность оплачивать покупки как в интернет магазинах так и в обычных магазинах. Во вторых бонусы и льготы. Карта от Тинькофф постоянно предлагает разнообразные акции и скидки в магазинах ресторанах и других заведениях что позволяет мне экономить на покупках. Кроме того у меня есть возможность накопления бонусных баллов за каждую покупку которые я впоследствии могу использовать для оплаты других товаров или услуг. Наконец простота и удобство управления своими счетами и финансами. Благодаря мобильному приложению от Тинькофф я всегда могу легко отслеживать мои расходы контролировать свой баланс и проводить любые необходимые операции с картой. Это действительно сэкономило мне много времени и нервов. В целом дебетовая карта Тинькофф это отличный выбор для тех кто ценит удобство безопасность и привлекательные бонусы. Я очень доволен своим выбором и рекомендую ее всем кто хочет иметь полный контроль над своими финансами.,5
Хочу выразить огромную благодарность за отзывчивость за грамотно построенную работу своевременное решение возникающих у клиентов вопросов и проблем. Обращалась несколько раз когда не совсем корректно работало у меня приложение когда не могла подгрузить чек к покупке во всём летал но объясняли и помогали решить,5
Давно являюсь клиентом банка ВТБ. Обратился в банк через мобильное приложение. Сотрудница банка весьма оперативно помогла со всеми моими вопросами касательно дебетовых карт и накопительных счетов. Помогла разобраться в нюансах которые мне были непонятны и дала развернутую информационную справку. Доволен обращение в банк.,5
Обратился в поддержку альфа банка с вопросом о получении бонуса за оформлени карты в размере рублей написал в поддержку альфа банка время ожидания составило немного времени примерно минуты.Сотрудники банка предоставили полную информацию касательно моей проблемы все стало понятно. Благодарю за качественную и быструю помощь . . . .,5
Не так давно стал клиентом банка Тинькоф все устраивает если возникают какие либо вопросы или проблемы моментально решает все реактивная служба поддержки. Взял через данный банк рассрочку все прозрачно и интуитивно понятно при погашении. Отдельное спасибо оператору Елизавете . Рекомендую данный банк к сотрудничеству всем,5
Не перестаю оставлять хорошие отзывы с как всегда помогли в чате по делу и без лишних вопросов. В нескоторых банках до сих пор допотопные системв... Неформальное общение оставляет приятное впечатление с такими сотрудниками приятно общаться Наталья успокоила ответила на вопрос не заставив долго ждать и пожелала прекрасного вечера,5
Тинькофф Поддержка просто великолепна выручали меня не единожды но особо впечатлила их работа в августе когда я собирался отдознуть за границей а перед этим за несколько дней до начала путешествия заказал в сервисе Яндекса доставку еды из ресторана. Ситуация такова что мне привезли вместо запеченных роллов какую то кашу но сервис доставки признавать свою вину не захотел и в итоге просто проигнорировал мои фотографии с претензиями на счёт качества купленного мной товара Я писал в чат и звонил просил забрать некачественный продукт и вернуть мне деньги на что получил отказ. В итоге будучи клиентом тинькофф по тарифу премиум решил сообщить поддержке Тинькофф о сложившейся ситуации августа не ожидая какого либо чуда но какого было мое удивление когда Тинькофф Поддержка связалась со мной в чате августа написала оператор Алина в и собрала полные данные о данном инциденте Я передал им все фотографии всю переписку с Яндексом и после этого просто ждал пока я в итоге отдыхал на море Тинькофф решили этот вопрос с Яндексом они оспорили данную операцию и вернули мне деньги это было великолепно и думаю что это единственный банк из тех что я знаю в нашей стране способный так помочь своему клиенту К тому же Тинькофф приятно удивляет своими другими сервисами в августе я смог побывать в бизнес зале аэропорта Шереметьево совершенно бесплатно и вообще пользуюсь Тинькофф уже примерно с или года очень рад что в своё время перешёл на этот банк и не стыдно было рекомендовать его друзьям,5
Очень нравится Тинькофф банк именно обратной связью. Обратилась за помощью в подключении премиум все быстро подключили и прислали на почту страховку взр. В чате любой вопрос решается за секунду. Сколько бы раз не обращалась всегда обьясняют все подробно и мгновенно решают вопрос. Я очень довольна этим банком,5
При переводе денежных средств мошейникам мою карту банк заблокировал на что очень благодарна спасибо за оперативность Я в целях подработки хотела сделать перевод по номеру карты хорошо что не успела. Сотрудники банка оперативно на это обратили внимание и заблокировали мой перевод. В целях безопасности мне перевыпустили карту. Спасибо,5
С пятого раза через чат операторы которого абсолютно неактивны и игнорят клиентов банка подал заявку на закрытие счета. После блокировки счета на него поступили денежные средства за возврат товара ненадлежащего качества. Вывести средства не представляется возможным. Связался с оператором контакт центра со второго раза и после минут ожидания. Помочь мне в восстановлении активности счета либо переводе денежных средств по реквизитам мне отказались ссылаясь что этим занимаются лишь операторы чата. Оператор чата находится не выходит на связь мой личный аккаунт неактивен а деньги в размере более т.р. застряли на счете и видимо я их не увижу.,5
Я хочу поделиться своим положительным отзывом о Альфа Банке. Я давно являюсь их клиентом и никогда не сталкивался с какими либо проблемами. Недавно я решил перевести свою зарплату в Альфа Банк так как у них были самые высокие проценты по вкладам и самые низкие тарифы по обслуживанию. Я пришел в офис и обратился к менеджеру Софии. Она очень быстро и качественно оформила для меня заявку на перевод зарплаты а также подобрала для меня самый подходящий вклад. Я был очень доволен ее работой и отношением к клиентам. Обращался августа года в .,1
При изучении мобильного приложения открыл вкладку с информацией о дебетовой карте . Когда читал бонусы карты случайно нажал кнопку оформления карты когда сам этого не планировал. После этого сразу обратился в тех.поддержку Тинькофф где мне быстро помогли отменить заявку на оформление премиальный дебетовой карты. Сотрудник Анастасия успокоила и помогла решить данное недоразумение. Обслуживанием крайне чем доволен Не раз уже убеждаюсь что сделал правильное решение при выборе банка,5
Пытался заказать дебетовую карту с доставкой на дом но на мой адрес доставки не оказалось город Волгоград живу в минутах от центра конкуренты по этому адресу карты доставляют . Пришлось идти в отделение электронной очереди нет ожидать сказали минут . Пришел в менее загруженное время но подождать минут пришлось. Приложение на айфон в удалили вины банка тут нет. Они предлагают альтернативу в виде версии сайта. Но в него придется либо логиниться каждый раз с паролем и кодом из смс либо использовать приложение для вохода при помощи . Но оно не работает Сделал все по инструкции удалял и заново устанавливал ключ. В тех поддержке отвечают долго и не смогли помочь. Можно установить приложение в отделении банка но придется выходить со своей учетной записи это не всем будет удобно. Не успел толком воспользоваться услугами банка но впечатление уже немного испорчено.,5
. Несколько месяцев назад рекомендовал коллеге по работе дебетовую карту Тинькофф вроде всё нормально проблемы начались на этапе встречи с представителем несколько раз переносил встречу потом оказалось что карту уже надо перевыпускать соответственно никто ничего не получил... Человек самостоятельно заказал в В.Новгороде. . Тому же человеку рекомендовал Тинькофф Инвестиции в рамках акции Приведи друга и результат тот же в отношении ко мне хотя все условия выполнены. Я конечно не обеднею но зачем вводить людей в заблуждение Раньше все было нормально.,3
удобное приложение в чате всегда быстро реагируют на вопросы давно являюсь клиентом и имею несколько карт и других банковских продуктов. сегодня оперативно помог решить вопрос с детской картой Александр Являясь премиум клиентов имею различные бонусы от банка такие как проходы в бизнес зал медицинская страховка на всю семью,4
. в по МСК в ТРЦ Афимолл зашел снять деньги в банкомате Сбера. Ввел сумму . в итоге минуты две он попыхтел и деньги не выдал. На экране высветилось что то по типу операция не выполнена средства вернутся на карту . У кого не спрашивал обычно деньги возвращаются моментально. Но тут прошло уже больше часов а денег на карте по прежнему нет. Меня это очень огорчает так как сумма не а . . Я позвони в поддержку через минут после сложившейся ситуации составили обращение срок рассмотрения которого до недели СБЕРБАНК почему я должен ждать свои деньги по вашей вине Мне нужны эти деньги срочно. Я сомневаюсь что очень сложно и долго проверить выдал ли мне банкомат деньги. После этого не хочется хранить большие суммы на карте вашего банка.,5
Один раз я тут уже писал тут отрицательный отзыв о данном банке что имела место быть некомпетентная консультация в чате приложения. Тогда отзыв был без оценки однако я предупредил что в случае повторения ситуации будет поставлена отрицательная оценка. И вот ситуация повторилась. На этот раз ситуация касается карты скидка везде . Эта карта даёт скидку на онлайн покупки. По условиям первые месяца без условий далее при совершении покупок. Однако в приложении я наблюдал несколько иную информацию. Карта была оформлена июля. Соответственно у меня должны были быть июль и август без условий с сентября если я в августе совершу покупок. Но по факту в приложении в августе счётчик покупок отсутствовал он показывался только во вкладке на сентябрь. Я этого не понял и спросил с чате приложения. Было это августа. Вот ответ оператора Максима Все верно. Вам нужно только с его месяца совершать до операций чтобы скидка была на онлайн покупки на все остальные покупки. С третьего месяца не со второго И вот наступил сентябрь и мне говорится что я лишаюсь скидки за онлайн потому что в августе не совершил покупок. Через чат по данной ситуации прошу создать обращение. Создаётся обращение номер . И сегодня я получаю ответ что я лишён скидки поскольку в августе не выполнил условие по покупкам. Т.е. банк не принял во внимание некомпетентную консультацию в чате приложения и отказался пойти мне на встречу. Исходя из этого я прошу банк на основании предоставленной консультации в чате приложения пересмотреть решение по данному обращению и включить мне скидку на сентябрь,1
Специалист службы поддержки Дарья П. очень помогла.Был вопрос по услуге оформления карты другу.Дарья помогла разобраться с вопросом и вопрос решился.Консультацией осталась я осталась очень довольна.Все было сделано быстро и оперативно. Спасибо большое. Дата обращения . . года в . .,1
Класный банк всегда войдёт в положение Если что могут выручить на . . реально удобно пользоваться для молодёжи самое то И ещё операторши классные знают свою работу На момент этого отзыва проходит акция какие то там призы за отзыв но я пишу не из за приза а по своей инциативе давно хотел и попал под акцию,5
В конце февраля года я решил открыть карту альфа банка и выбрал платёжную систему . Потом узнал о том что они покидают российский рынок и был очень обеспокоен данной новостью ведь боялся что мою первую в жизни банковскую карту заблокируют. В итоге решил обратиться в отделение и узнал о том как будут работать иностранные платёжные системы и успокоился узнав что по территории России они будут работать в штатном режиме. Консультанты объяснили вежливо и понятно всю ситуацию. Я рад что выбрал именно этот банк,5
Замечательный банк пользуюсь картой уже год всё всегда работает. Сегодня я чуть не потеряла по своей глупости деньги но мониторинг система банка успешна заблокировала перевод и помогла мне сохранить мои деньги мне объяснили все этапы работы мошенников и как не попадаться в из руки. Также у банка очень интересная система кеш бека и много разных приятных бонусов.,5
Оформлял карту джуниор для ребенка но указал не тот номер при регистрации. Написал в чат быстро связались по видеосвязи для верификации и удачно сменили номер без лишних заявлений и обращений в банк. Также за несколько дней до этого была оформлена кредитная карта которую я оформил без промокода через время увидел рекламный пост про бонус и написал об этом в поддержку и меня без проблем включили в акцию.,5
Заказал стикер пришел довольно быстро оформление и весь процесс тоже занял не долгое время. Бесплатное оформление Единственная проблема в том что мне сделали счета а зачем непонятно. Решить это дистанционно было никак поэтому пришлось опять идти в банк. Хотя по итогу моих рук ног паспорта никто не ждал и я там не нужен был почему нельзя было сделать все дистанционно так и не понятно. В итоге сказали что в течении дня решат но прошло дня и то когда я им лишь написал опять они мне убрали ненужный счет. Еще мне сделали платные смс хотя я просил мне вообще ничего не оформлять и убрать все платные услуги. Девушка сказала что ничего не будет но в итоге наврала,5
Пока конкретно ничего сказать не могу. Начну пользоваться картой будет более ясная картина. Эту карту мне посоветовал мой знакомый и если мне она тоже понравится то и я буду советовать её своим друзьям и родственникам. Надеюсь меня всё устроит в обслуживании карты. К стати очень удобно то что карту мне привезли прямо на работу и очень быстро оформили.,5
Благодарю за сервис ведущего менеджера Грачева Александра. Доступно объяснил суть открытия вкладов и счетов. Помог подобрать выгодные условия по обслуживанию. Дал понять как работают деньги и поделился ценными советами. С этого дня мое видение по работе банков существенно расширилось плюс в моем гардеробе появилась новая карточка МИР от МКБ. Желаю Александру удачи в развитии по специальности.,5
