Text,Rating
Обратился в поддержку . . в через мобильное приложение Тинькофф ответил специалист Алексей . Вопрос касался условий оплаты посещения бизнес зала с подпиской Тинькофф премиум специалист быстро и доступно объяснил как воспользоваться услугой. Остался доволен спасибо Алексею за консультацию.,4
Заказ дебетовую карту через сайт с доставкой через представителя. . . получаю смс от банка Встреча с Представителем Банка . . с до . Не забудьте оригинал паспорта. Банк ГПБ АО . Представитель банка позвонил заблаговременно уточнил по времени. При выдаче карты сказал карту надо зарегистрировать самостоятельно через приложение через минут . Далее при попытке пройти регистрацию появляется сообщение Доступ заблокирован попробуйте позже . Позвонил в поддержку сказали что надо подождать день. Через ошибка та же. Звоню в поддержку говорят что мне надо подойти в офис чтобы актуализировать свои данные. Теперь вопрос о каких данных идёт речь Я только получил пластик подписался под ней а пользоваться не могу. Зачем такой сервис если регистрация карт онлайн ещё сырая Когда я теперь должен найти время чтобы успеть в банк Пусть приезжает представитель банка который выдал нерабочую карту и актуализирует данные.,5
Всю зарплату перевожу на Альфа банк. Там всегда есть кешбек. Очень выручает до зарплаты. Супер. Посадила мужа на этот банк. Ему очень нравится. Теперь соревнуемся у кого больше кешбек и стараемся закупаться только через карту. Ещё переводы все без комиссий. Не нужно долго вводить через меню быстрые переводы. Все автоматически. Хотим брать ипотеку через банк. Игры там бывают. В самом приложении банка. Тоже можно получить деньги. Люблю этот банк. Он лучший.,1
Благодарю менеджера Татьяну за очень полную информацию по поводу оформления металлической карты Тинькофф Банк а. За помощь оказанную мне всё чётко и понятно разъяснила и сделала. Подбирала несколько вариантов которыми можно было упростить получение карты в другом регионе. Выбрали один из вариантов. Ставлю высокий балл за компетентность данного менеджера Благодарю.,5
Добрый день сегодня вечером я зашел в приложение Тинькофф банк чтоб почитать разную интересную информацию. Наткнулся я на карту тинькофф блек премиум захотел более детально изучить условия данного продукта. Но случайно сразу же оформил карту в изготовление но по сути сама карта мне не нужна но чтоб её закрыть нужно было платить рублей за изготовление хотя я её оформил минуты назад естественно карту еще не успели изготовить. Я написал в тех. поддержку думал что будут как зачастую это бывает долгие ответы не понятные предложения и по итогу все равно придется платить. Но какого было мое удивление когда мне ответила девушка сотрудник Татьяна . Она ответила очень быстро была максимально вежлива и приветлива сразу же поняла о чем идет речь и тут же в течении пары минут решила все мои проблемы. Все подробно рассказала и сказала не волноваться. Новый продукт который я случайно оформил заблокировала деньги не списались все рассказала меня успокоила. В целом обслуживание просто на высшем уровне тем более если учитывать то что это все в онлайн а не в живую. Еще раз выражаю огромную благодарность сотруднице Татьяне .,5
Здравствуйте хочу порекомендовать тинёк так как уже много лет пользуюсь им и недавно как раз перешёл на примиум. В целом за столь долгий срок эксплуатации банка могу поставить твердую без плюса у всех есть недостатки конечно бывали косяки но всегда разбирались с ними и помогали. Тех. поддержку хвалю так как большой штат сотрудников и большинство мне нормальные отвечают В общем и целом прям доволен жуть ну и я как бы не профан и не косячу по банковским моментам и благодарю кстати Михаила из тех. поддержки за то что посоветовал отзыв оставить,5
Хочу похвалить работу сотрудников Альфа Банка. Не раз обращалась как в офис при вопросах по приложению так и на горячую линию просила проверить звонок на мошенничество так и в чат банка были вопросы по продуктам. Специалисты всегда вежливые быстро отвечают и делают все чтобы разрешить возникшую проблему. Отдельно хочу отметить офис банка для работы с клиентами. Очень интересный подход офис выглядит почти как кафе стоят столики и кресла специалисты сами к вам подходят. Это довольно необычно но находится в таком удобнее чем в обычных офисах где стоят окна.,5
Пользуюсь картой альфабанка уже несколько лет. Очень нравятся категории кешбека которые можно ввбирать раз в месяц. А также суперкешбек до в выбранной категории. Служба поддержки моментально отвечает на любые вопросы. Проценты по вкладам самые высокие. Банк предлагает много интересных продуктов. Сейчас хочу попробовать инвестиции с альфабанком которому доверяю. У банка мега удобное шустрое приложение что ещё надо современному человеку. ТОП банк одним словом.,5
Здравствуйте. Очень нравится банк Тинькофф особенно тех.поддержка. Не приходится ждать по несколько часов всегда отвечают быстро и по делу. . . случились проблемы с дебитовой картой обратился в техническую поддержку описал проблему и через несколько секунд сразу же ответил оператор Павел . Самое главное чем мне нравится банк Тинькофф так это своей технической поддержкой. Продолжайте в том же духе.,5
сентября ночью заказала себе дебетовую карту через сайт сентября уже была назначена встреча с представителем банка Михаилом представитель приехал в назначенное время предварительно позвонил как было указано в комментариях встреча прошла в приятной атмосфере Михаил ответил на все мои вопросы по продукту объяснил условия использования и рассказал про преимущества Очень было приятно пообщаться с Михаилом побольше бы таких сотрудниках во всех банках,5
Я уже года пользуюсь услугами банка Тинькофф и за это время я ни разу в нем не разочаровался Все всегда на высшем уровне А в последнее время когда мне нужно было установить мобильное приложение банка а также выпустить платежный стикер что тоже очень удобная вещь служба поддержки сделала все на высшем уровне проконсультировала меня подстроилась под мое расписание и назначила встречу со специалистом. Все прошло первоклассно,5
Хочу выразить огромную благодарность Дмитрию Таликову из отдела сопровождения банковских проверок. Очень грамотный и вежливый специалист а главное на знает свою работу. На протяжении всего процесса решения моей проблемы блокировка карты давал корректные и ценные советы и указания. Несколько месяцев назад я писала здесь негативный отзыв касательно данного банка т.к. сам Банк очень удобный интерфейс мобильного приложения на уровне но операции для меня были приостановлены. Но благодаря Дмитрию я снова могу пользоваться Тинькофф банком. Ещё раз спасибо,5
Всегда хвалил поддержку Тинькоффа. У меня друг захотел открыть себе виртуальную карту без пластиковой но именно Тинькофф. Я уже пользуясь Тинькоффом через приложение написал в чат с поддержкой и задал вопрос. Мне очень быстро ответили и предоставили всю нужную информацию по тому как открыть такую карту какие у ней лимиты как их увеличить и так далее. Друг по данной инструкции смог успешно открыть такую карту и уже ей пользуется и доволен. Мне ответила сотрудник Лилия обращался я августа около полуночи. Больше всего понравилось то что поддержка быстро отвечает даже ночью мне не приходилось ждать больше минут.,5
Добрый вечер. В июле была большая покупка поэтому было накоплено бонусов. При наступлении отчётного периода выплатили только р. Такие условия банка. При обращении в поддержку сотрудники категорически отказывались возместить разницу. Общение в чате привело меня на Главного специалиста Клиентского сервиса Соколова Романа который за мин. решил вопрос. Спасибо Совкомбанку за его лояльность и особенно Роману Соколову. Буду продолжать хранить свои деньги в этом банке и пользоваться его услугами.,5
Я оформляла карту по акции в которой было сказано что я получу кэшбэк. Через некоторое время я выполнила условия чтобы его мне начислили я испугалась что мне его не зачислят так как прошло много времени я обратилась в чат с поддержкой объяснила проблему и мне сказали что всё хорошо и кэшбэк зачислится в течении дней после активации сейчас очень жду когда это произойдёт и благодарю Альфа Банк за уточнение теперь я спокойно жду начисления вот фото переписки . . .,5
Добрый день. Обращалась в офис банка ВТБ г. Перми по адресу Сибирская очень понравилось обслуживание. Персональный менеджер Гайнуллина Дарья подробно ответила на мои вопросы подробно и доступно рассказала про услуги банка. Планирую в дальнейшем пользоваться услугами банка. Хочу выразить благодарность данному сотруднику.,5
Неоднократно брала через ХоумБанк рассрочку. На сегодняшний день для меня это лучший банк. Самый честный банк. Никаких лишних процентов обмана и всего прочего Мои знакомые пользуются ХоумБанком так же довольны. Если брать рассрочку переплата очень маленькая копейки по сравнению с другими банками. С другими банками был не очень приятный опыт. Поэтому доверяю только ХоумБанку,5
Год назад перешёл с Тинькофф на Альфа банк когда искал удобную дебетовую карту. За год пользования показалось куда более удобным намного лучше ежемесячные категории кэшбека актуальные категории кэшбека типа фастфуда кафе транспорта развлечений и т.д. удобная техподдержка быстро решают вопросы в чате плюс в отличие от Тинькофф есть офисы по Москве где можно непосредственно с сотрудником решить вопрос отдельная благодарность сотрудникам офиса у метро Пролетарская всегда быстро решают вопрос и в целом приветливые и адекватные сотрудники Выгодная ставка по накопительной счету удобно пользоваться Короче говоря рекомендую,5
Недавно узнал о том что у Альфа банка есть дебетовая карта пятерочки. Так как в моем районе находится данный магазин решил поподробней узнать о данной карте поэтому решил побольше узнать о данной карте. Нашел информацию на сайте условия меня устроили. . заказал карту. Заявка оформляется в течении х минут и есть возможность выбрать удобное для себя время когда приедет представитель. Так как у меня не получилось встретиться в назначенное время я . позвонил в контактный центр где попросил перенести доставку на следующий день сотрудник банка Екатерина с удоволиствием помогла мне в этом вопросе. На следующий день в назначенное время приехал представитель Дмитрий который рассказал все условия пользования картой и помог подключить нужный пакет для получения бонусов. Вся процедура заняла у нас минут вместе с установкой приложения . Работой банка полностью доволен,5
сентября г. в обратилась в чат с вопросом по поводу кэшбэка за фастфуд и в супермаркетах. В сентябре у меня выбрана категория повышенного кэшбэка как раз на фастфуд. Интересовало почему не начислен кэшбэк за часть чеков там а также ещё в супермаркетах. Оператор Камилла взяла задачу в работу и перевела на оператора Марию. Мария чуть позже объяснила что оказывается на чеки до ста рублей кэшбэк мне предусмотрен. Он начисляется на покупки от и в ходе исчисления его база округляется в меньшую сторону к кратной ста сумме. Буду иметь это в виду. Мария спасибо за оперативность и информативный ответ,5
Иногда возникают проблемы с начислением кэшбэка из за того что у ресторана в приложении Тинькофф отражается категория кафе или у некоторых ресторанов вкусно и точка до сих пор в Тинькофф название Макдональдс и кэшбэк по категории не проходит. Такие вопросы поддержка банка Тинькофф решает быстро и в пользу клиента.,5
Тинькофф банк лучший банк из которых я пользовался быстрая поддержка быстрое решение проблем быстро зачисление денег везде есть точки пополнения заказывали карту пришла на следующий день так что могу сказать это один из лучших банков котормы я пользовался и советую его всем не пожалееете что стали клиентом банка,5
Здравствуйте. Хочу похвалить Альфа Банк и всех его сотрудников. Не секрет что до Альфа Банка я пользовался другими банками. Я считал что Сбербанк хороший но там почти нет никакой выгоды. Перешёл на Тинькофф но мне надоели вечные сбои с приложением и холодным обслуживанием. И вот оно случилось я нашел идеальный банк им оказался Альфа Банк. Если у меня есть какие то вопросы мне моментально отвечают и со всем уважением обращаемся и общаемся друг с другом. Очень много выгодных предложений от партнёров и много разных категорий повышенного кэшбека Всегда на выбор найдется именно тот повышенный кэшбэк который мне нужен. Никаких комиссий как у некоторых. Очень удобное приложение. Помимо всего этого мне очень нравится что там часто проходят викторины и игры в которые я с удовольствием играю ведь помимо хороших эмоций они дарят ещё и разные подарки Спасибо Вам большое что карта Вашего банка оказалась у меня в руках. Пользуюсь уже больше года и не собираюсь менять,5
Добрый вечер. Все понравилось. На все интересующие вопросы получила ответы. Очень грамотный молодой человек. Вручили карту раньше чем планировалось согласовали встречу и выбрали удобное время для меня. Вручили карту в запечатанном конверте. Работник банка помог активировать карту. И рассказал о кэшбэке.,5
В конце этого лета возникла необходимость получения карты для оплаты товаров и услуг. Не долго думая я зашёл на просторы интернета с запросом получить дебитовую карту получил множество вариантов. Немного почитав условия получения остановился на дебитовой карте Альфа банка. Здесь было множество бонусов от получения кэшбэка до бесплатного обслуживания далее прошёл по ссылке заполнил быстренько заявку на получение. Что порадовало так это скорость днём заполнил заявку через несколько часов получил карту и уже вечером сделал с её помощью первую покупку. Очень понравилось работу с банком всё чётко быстро и удобно. Спасибо Альфа банку.,5
